{
  "schema_version": "1.0",
  "profile_id": "profile-prometheus-demo",
  "constraints": {
    "cpu_cores_min": 8,
    "memory_mib_min": 32768,
    "storage_gib_min": 20,
    "accelerator": {
      "required": true,
      "type": "GPU",
      "count_min": 1,
      "memory_mib_min_per_device": 12000
    }
  },
  "preferences": {
    "max_results": 3
  }
}
